{
  "kind": "SpecDDBenchmark",
  "schemaVersion": "1.0.0",
  "id": "local-score-conformance",
  "version": "1.0.0",
  "scope": "eval-node",
  "task": {
    "id": "score-fixtures",
    "inputRef": "sha256:356bdf3f23269f8ed3ad115d96921bf893712fd7ead01d2b94cc832cc2e8baa2",
    "sha256": "356bdf3f23269f8ed3ad115d96921bf893712fd7ead01d2b94cc832cc2e8baa2"
  },
  "workflowRef": "manual-review",
  "repetitions": 3,
  "baselineRef": "default",
  "eval": {
    "kind": "SpecDDEval",
    "schemaVersion": "1.0.0",
    "id": "score-conformance",
    "version": "1.0.0",
    "name": "Pinned score fixture conformance",
    "method": "mechanical",
    "rubric": "Run both pinned canonical score-normalization test files. Completed exit zero passes; nonzero fails. This measures fixture conformance only.",
    "labels": [
      {
        "id": "passed",
        "description": "Both fixed tests passed",
        "score": 1
      },
      {
        "id": "failed",
        "description": "A fixed test failed",
        "score": 0
      }
    ],
    "passingScore": 1
  },
  "configurations": [
    {
      "id": "default",
      "graphRef": "manual-review-graph",
      "nodeRef": "evaluate",
      "controlPlaneSha256": "e556e480476da5221bd4f369fa8b1db40f81dfd69a42823dc90024226bc7cf3c",
      "runtime": "node-test",
      "model": null,
      "harnessRef": null,
      "capabilityRefs": [],
      "promptStrategyRef": null,
      "environmentRef": "sha256:ff5a9186ff9ccc0d36a91806bdfdb63efe0ae5ab58b391a4417c6cf3daac0dab",
      "executionRef": "sha256:9ed0a1281cc2b9a6d32d525dd4644d8311fcb97d90e07048f1190aa7cc28a360"
    },
    {
      "id": "serial",
      "graphRef": "manual-review-graph",
      "nodeRef": "evaluate",
      "controlPlaneSha256": "e556e480476da5221bd4f369fa8b1db40f81dfd69a42823dc90024226bc7cf3c",
      "runtime": "node-test",
      "model": null,
      "harnessRef": null,
      "capabilityRefs": [],
      "promptStrategyRef": null,
      "environmentRef": "sha256:ff5a9186ff9ccc0d36a91806bdfdb63efe0ae5ab58b391a4417c6cf3daac0dab",
      "executionRef": "sha256:88bf94f40591afb00e439de53202cf8383ab4175dd619cd662b2f6f20f4ce06b"
    }
  ]
}
